{
  "format": "phebs-document-schema-v1",
  "source_class": "authored",
  "tables": [
    {
      "name": "Queue",
      "fields": [
        {
          "path": [
            {
              "kind": "field",
              "name": "id"
            }
          ],
          "type": "opaque:string"
        },
        {
          "path": [
            {
              "kind": "field",
              "name": "old"
            }
          ],
          "type": "opaque:string"
        },
        {
          "path": [
            {
              "kind": "field",
              "name": "stable"
            }
          ],
          "type": "opaque:string"
        }
      ],
      "primary_key": [
        {
          "path": [
            {
              "kind": "field",
              "name": "id"
            }
          ]
        }
      ],
      "indexes": [],
      "associations": []
    }
  ],
  "views": []
}
